{
 "schema_version": "1.1.0",
 "generated_at": "2026-10-15T19:46:19Z",
 "latest_period": "2024",
 "eu": {
  "period": "2024",
  "fatalities": 19933,
  "fatalities_status": "unknown",
  "rate_per_million": 44.3,
  "rate_status": "estimated",
  "previous_period": "2023",
  "previous_fatalities": 20386,
  "previous_status": "unknown",
  "yoy_change_abs": -453,
  "yoy_change_percent": -2.2221132149514373,
  "baseline_period": "2019",
  "baseline_fatalities": 22757,
  "change_from_baseline_percent": -12.409368545941907,
  "target_period": "2030",
  "target_fatalities": 11378.5,
  "progress_towards_target_fraction": 0.24818737091883816
 },
 "coverage": {
  "period": "2024",
  "member_states_reporting": 27,
  "member_states_total": 27,
  "missing": []
 },
 "countries": [
  {
   "geo": "BE",
   "iso2": "BE",
   "name": "Belgium",
   "period": "2024",
   "fatalities": 470,
   "status": "unknown",
   "rate_per_million": 39.7,
   "rate_status": "unknown",
   "yoy_change_percent": -6.187624750499002,
   "change_from_baseline_percent": -27.24458204334365
  },
  {
   "geo": "BG",
   "iso2": "BG",
   "name": "Bulgaria",
   "period": "2024",
   "fatalities": 478,
   "status": "unknown",
   "rate_per_million": 74.2,
   "rate_status": "unknown",
   "yoy_change_percent": -8.952380952380953,
   "change_from_baseline_percent": -23.88535031847134
  },
  {
   "geo": "CZ",
   "iso2": "CZ",
   "name": "Czechia",
   "period": "2024",
   "fatalities": 494,
   "status": "unknown",
   "rate_per_million": 45.3,
   "rate_status": "unknown",
   "yoy_change_percent": -1.593625498007968,
   "change_from_baseline_percent": -20.06472491909385
  },
  {
   "geo": "DK",
   "iso2": "DK",
   "name": "Denmark",
   "period": "2024",
   "fatalities": 145,
   "status": "unknown",
   "rate_per_million": 24.3,
   "rate_status": "unknown",
   "yoy_change_percent": -10.493827160493826,
   "change_from_baseline_percent": -27.1356783919598
  },
  {
   "geo": "DE",
   "iso2": "DE",
   "name": "Germany",
   "period": "2024",
   "fatalities": 2770,
   "status": "unknown",
   "rate_per_million": 33.2,
   "rate_status": "unknown",
   "yoy_change_percent": -2.4304332511447693,
   "change_from_baseline_percent": -9.061063690085359
  },
  {
   "geo": "EE",
   "iso2": "EE",
   "name": "Estonia",
   "period": "2024",
   "fatalities": 69,
   "status": "unknown",
   "rate_per_million": 50.3,
   "rate_status": "unknown",
   "yoy_change_percent": 16.94915254237288,
   "change_from_baseline_percent": 32.69230769230769
  },
  {
   "geo": "IE",
   "iso2": "IE",
   "name": "Ireland",
   "period": "2024",
   "fatalities": 171,
   "status": "unknown",
   "rate_per_million": 31.7,
   "rate_status": "unknown",
   "yoy_change_percent": -5.0,
   "change_from_baseline_percent": 22.142857142857142
  },
  {
   "geo": "EL",
   "iso2": "GR",
   "name": "Greece",
   "period": "2024",
   "fatalities": 664,
   "status": "unknown",
   "rate_per_million": 64.0,
   "rate_status": "unknown",
   "yoy_change_percent": 2.786377708978328,
   "change_from_baseline_percent": -3.488372093023256
  },
  {
   "geo": "ES",
   "iso2": "ES",
   "name": "Spain",
   "period": "2024",
   "fatalities": 1785,
   "status": "unknown",
   "rate_per_million": 36.5,
   "rate_status": "unknown",
   "yoy_change_percent": -1.1627906976744187,
   "change_from_baseline_percent": 1.7094017094017095
  },
  {
   "geo": "FR",
   "iso2": "FR",
   "name": "France",
   "period": "2024",
   "fatalities": 3181,
   "status": "unknown",
   "rate_per_million": 46.3,
   "rate_status": "provisional",
   "yoy_change_percent": 0.8560558021559923,
   "change_from_baseline_percent": -1.7603458925262507
  },
  {
   "geo": "HR",
   "iso2": "HR",
   "name": "Croatia",
   "period": "2024",
   "fatalities": 239,
   "status": "unknown",
   "rate_per_million": 61.8,
   "rate_status": "unknown",
   "yoy_change_percent": -12.773722627737227,
   "change_from_baseline_percent": -19.52861952861953
  },
  {
   "geo": "IT",
   "iso2": "IT",
   "name": "Italy",
   "period": "2024",
   "fatalities": 3030,
   "status": "unknown",
   "rate_per_million": 51.4,
   "rate_status": "unknown",
   "yoy_change_percent": -0.29615004935834155,
   "change_from_baseline_percent": -4.506775921840529
  },
  {
   "geo": "CY",
   "iso2": "CY",
   "name": "Cyprus",
   "period": "2024",
   "fatalities": 41,
   "status": "unknown",
   "rate_per_million": 42.1,
   "rate_status": "unknown",
   "yoy_change_percent": 20.588235294117645,
   "change_from_baseline_percent": -21.153846153846153
  },
  {
   "geo": "LV",
   "iso2": "LV",
   "name": "Latvia",
   "period": "2024",
   "fatalities": 112,
   "status": "unknown",
   "rate_per_million": 59.9,
   "rate_status": "unknown",
   "yoy_change_percent": -18.84057971014493,
   "change_from_baseline_percent": -15.151515151515152
  },
  {
   "geo": "LT",
   "iso2": "LT",
   "name": "Lithuania",
   "period": "2024",
   "fatalities": 124,
   "status": "unknown",
   "rate_per_million": 42.9,
   "rate_status": "unknown",
   "yoy_change_percent": -22.0125786163522,
   "change_from_baseline_percent": -33.33333333333333
  },
  {
   "geo": "LU",
   "iso2": "LU",
   "name": "Luxembourg",
   "period": "2024",
   "fatalities": 18,
   "status": "unknown",
   "rate_per_million": 26.6,
   "rate_status": "unknown",
   "yoy_change_percent": -30.76923076923077,
   "change_from_baseline_percent": -18.181818181818183
  },
  {
   "geo": "HU",
   "iso2": "HU",
   "name": "Hungary",
   "period": "2024",
   "fatalities": 497,
   "status": "unknown",
   "rate_per_million": 52.0,
   "rate_status": "unknown",
   "yoy_change_percent": 5.296610169491525,
   "change_from_baseline_percent": -17.441860465116278
  },
  {
   "geo": "MT",
   "iso2": "MT",
   "name": "Malta",
   "period": "2024",
   "fatalities": 12,
   "status": "unknown",
   "rate_per_million": 21.1,
   "rate_status": "unknown",
   "yoy_change_percent": -25.0,
   "change_from_baseline_percent": -25.0
  },
  {
   "geo": "NL",
   "iso2": "NL",
   "name": "Netherlands",
   "period": "2024",
   "fatalities": 566,
   "status": "unknown",
   "rate_per_million": 31.5,
   "rate_status": "unknown",
   "yoy_change_percent": -6.907894736842106,
   "change_from_baseline_percent": -3.4129692832764507
  },
  {
   "geo": "AT",
   "iso2": "AT",
   "name": "Austria",
   "period": "2024",
   "fatalities": 351,
   "status": "unknown",
   "rate_per_million": 38.2,
   "rate_status": "unknown",
   "yoy_change_percent": -12.686567164179104,
   "change_from_baseline_percent": -15.625
  },
  {
   "geo": "PL",
   "iso2": "PL",
   "name": "Poland",
   "period": "2024",
   "fatalities": 1896,
   "status": "unknown",
   "rate_per_million": 51.9,
   "rate_status": "unknown",
   "yoy_change_percent": 0.15847860538827258,
   "change_from_baseline_percent": -34.82296321760055
  },
  {
   "geo": "PT",
   "iso2": "PT",
   "name": "Portugal",
   "period": "2024",
   "fatalities": 618,
   "status": "unknown",
   "rate_per_million": 54.7,
   "rate_status": "unknown",
   "yoy_change_percent": -3.7383177570093453,
   "change_from_baseline_percent": -10.174418604651162
  },
  {
   "geo": "RO",
   "iso2": "RO",
   "name": "Romania",
   "period": "2024",
   "fatalities": 1478,
   "status": "unknown",
   "rate_per_million": 77.6,
   "rate_status": "estimated",
   "yoy_change_percent": -4.3365695792880254,
   "change_from_baseline_percent": -20.70815450643777
  },
  {
   "geo": "SI",
   "iso2": "SI",
   "name": "Slovenia",
   "period": "2024",
   "fatalities": 68,
   "status": "unknown",
   "rate_per_million": 32.0,
   "rate_status": "unknown",
   "yoy_change_percent": -19.047619047619047,
   "change_from_baseline_percent": -33.33333333333333
  },
  {
   "geo": "SK",
   "iso2": "SK",
   "name": "Slovakia",
   "period": "2024",
   "fatalities": 262,
   "status": "unknown",
   "rate_per_million": 48.3,
   "rate_status": "unknown",
   "yoy_change_percent": -1.5037593984962405,
   "change_from_baseline_percent": -2.9629629629629632
  },
  {
   "geo": "FI",
   "iso2": "FI",
   "name": "Finland",
   "period": "2024",
   "fatalities": 181,
   "status": "unknown",
   "rate_per_million": 32.2,
   "rate_status": "unknown",
   "yoy_change_percent": -2.1621621621621623,
   "change_from_baseline_percent": -14.218009478672986
  },
  {
   "geo": "SE",
   "iso2": "SE",
   "name": "Sweden",
   "period": "2024",
   "fatalities": 213,
   "status": "unknown",
   "rate_per_million": 20.2,
   "rate_status": "unknown",
   "yoy_change_percent": -6.986899563318777,
   "change_from_baseline_percent": -3.619909502262444
  }
 ]
}
